{
  "$schema": "http://json-schema.org/draft-07/schema#",
  "title": "EdgeTX Lua Scripts Gallery - scripts.json",
  "description": "Schema for scripts.json. Also the canonical source for the known 'category' and 'tags' vocabularies, read and written at runtime by tools/sync_issue_template_options.py to keep the Issue Form templates in sync with actual usage in scripts.json. 'category.examples' and 'tags.items.examples' are machine-generated - do not hand-edit them, they will be overwritten on the next sync. category.examples grows monotonically (never auto-pruned); tags.items.examples is a pure snapshot of current usage (shrinks when a tag falls out of use).",
  "type": "array",
  "items": {
    "type": "object",
    "title": "ScriptEntry",
    "required": [
      "name",
      "category",
      "description",
      "infourl",
      "tags"
    ],
    "properties": {
      "name": {
        "type": "string",
        "minLength": 1,
        "description": "Display name as shown in the gallery."
      },
      "category": {
        "type": "string",
        "minLength": 1,
        "description": "Gallery category - drives the site's top-level navigation tabs. Machine-generated examples list below (monotonic add-only, see tools/sync_issue_template_options.py).",
        "examples": [
          "Audio & Media",
          "Flight Controller Config",
          "Games & Fun",
          "GPS & Mapping",
          "Logging & Analysis",
          "Radio Tools",
          "Telemetry & Widgets"
        ]
      },
      "description": {
        "type": "string",
        "minLength": 1,
        "description": "Short 1-3 sentence description of the script."
      },
      "infourl": {
        "type": "string",
        "format": "uri",
        "description": "Link to the project page, GitHub repo, or documentation. Must start with http:// or https:// (enforced by tools/validate_scripts.py and tools/issue_to_scripts.py, not by this schema)."
      },
      "images": {
        "type": "array",
        "items": {
          "type": "string"
        },
        "description": "Screenshot references: local ASSETS/ paths or external image URLs."
      },
      "tags": {
        "type": "array",
        "minItems": 1,
        "items": {
          "type": "string",
          "minLength": 1,
          "description": "Machine-generated examples list below (current usage snapshot, see tools/sync_issue_template_options.py).",
          "examples": [
            "ardupilot",
            "battery",
            "betaflight",
            "black-and-white",
            "bluetooth",
            "color",
            "crawler",
            "crossfire",
            "expresslrs",
            "fixed-wing",
            "game",
            "ghost",
            "gps",
            "heli",
            "inav",
            "logging",
            "multi-protocol",
            "quad",
            "rotorflight",
            "script",
            "spektrum",
            "telemetry",
            "tool",
            "widget"
          ]
        }
      }
    },
    "additionalProperties": true
  }
}
