[
  {
    "name": "ExpressLRS Configurator",
    "category": "Flight Controller Config",
    "description": "LUA configurator for ExpressLRS hardware.",
    "infourl": "https://www.expresslrs.org/3.0/quick-start/transmitters/lua-howto/",
    "images": [
      "ASSETS/expresslrs-configurator/screenshot-1.jpg",
      "ASSETS/expresslrs-configurator/screenshot-3.png"
    ],
    "tags": [
      "expresslrs",
      "script",
      "color",
      "black-and-white"
    ]
  },
  {
    "name": "ExpressLRS Telemetry Widget (Betaflight & iNav)",
    "category": "Telemetry & Widgets",
    "description": "Display ExpressLRS LinkStats telemetry as well as common Betaflight and iNav flight controller telemetry.",
    "infourl": "https://github.com/ExpressLRS/ElrsTelemWidget",
    "images": [
      "ASSETS/expresslrs-telemetry-widget-betaflight-inav/screenshot-1.png"
    ],
    "tags": [
      "expresslrs",
      "betaflight",
      "inav",
      "widget",
      "color"
    ]
  },
  {
    "name": "ExpressLRS RF Telemetry Widget (for fixed wing/heli)",
    "category": "Telemetry & Widgets",
    "description": "Display RF Only telemetry for Planes/Heli/Glider. Shows rf-rate, link-quality, power, rssi1, rssi2, min & max indicators, and post flight summary with auto-detection end-of-flight.",
    "infourl": "https://github.com/offer-shmuely/edgetx-x10-widgets/wiki/els_rf",
    "images": [
      "ASSETS/expresslrs-rf-telemetry-widget-for-fixed-wing-heli/screenshot-1.gif"
    ],
    "tags": [
      "expresslrs",
      "widget",
      "color",
      "fixed-wing",
      "heli"
    ]
  },
  {
    "name": "ELRS Finder",
    "category": "Radio Tools",
    "description": "An RSSI-based quad finder using ELRS/CRSF telemetry. Shows live signal strength (dBm), displays a bar graph and numeric value, and plays faster beeps as you point toward the quad.",
    "infourl": "https://github.com/iamsunilchahal/edgetx-lua-scripts-bw?tab=readme-ov-file#1-elrs_finderlua",
    "images": [],
    "tags": [
      "expresslrs",
      "script",
      "black-and-white",
      "quad"
    ]
  },
  {
    "name": "ExpressLRS Signal/Battery Widgets for ColorLCD",
    "category": "Telemetry & Widgets",
    "description": "LQorDBM widget for LQ, DBM, SNR and TX power. TXBatt widget for transmitter battery voltage and percentage. Battery widget for any battery sensor.",
    "infourl": "https://github.com/SpiderFI",
    "images": [
      "ASSETS/expresslrs-signal-battery-widgets-for-colorlcd/screenshot-1.jpg"
    ],
    "tags": [
      "expresslrs",
      "widget",
      "color"
    ]
  },
  {
    "name": "Yaapu Telemetry Widget",
    "category": "Telemetry & Widgets",
    "description": "ArduPilot LUA telemetry script for color and B&W radios.",
    "infourl": "https://github.com/yaapu/FrskyTelemetryScript",
    "images": [
      "ASSETS/yaapu-telemetry-widget/screenshot-1.png",
      "ASSETS/yaapu-telemetry-widget/screenshot-3.png",
      "ASSETS/yaapu-telemetry-widget/screenshot-5.png",
      "ASSETS/yaapu-telemetry-widget/screenshot-7.png"
    ],
    "tags": [
      "ardupilot",
      "widget",
      "color",
      "black-and-white",
      "fixed-wing",
      "heli",
      "quad"
    ]
  },
  {
    "name": "Yaapu Horus Mapping Widget",
    "category": "GPS & Mapping",
    "description": "Offline GPS Mapping Widget for Horus and T16 radios. Supports Ardupilot, iNAV, Betaflight, Crossfire and whatever FC or firmware that can send GPS info to EdgeTX.",
    "infourl": "https://github.com/yaapu/HorusMappingWidget",
    "images": [
      "ASSETS/yaapu-horus-mapping-widget/screenshot-1.png"
    ],
    "tags": [
      "ardupilot",
      "inav",
      "betaflight",
      "crossfire",
      "widget",
      "color",
      "fixed-wing",
      "heli",
      "quad"
    ]
  },
  {
    "name": "GPS Widget",
    "category": "GPS & Mapping",
    "description": "GPS Telemetry Widget for B&W and Color radios. Shows total distance traveled, distance from home, as well as both home and last seen telemetry positions. Also logs to file with a built-in log viewer.",
    "infourl": "https://github.com/moschotto/OpenTX_GPS_Telemetry",
    "images": [
      "ASSETS/gps-widget/screenshot-1.png",
      "ASSETS/gps-widget/screenshot-3.png"
    ],
    "tags": [
      "widget",
      "color",
      "black-and-white"
    ]
  },
  {
    "name": "GPS Plus Code, Home Arrow and AvgBatt Widgets",
    "category": "GPS & Mapping",
    "description": "Collection of ColorLCD and B&W widgets. For ColorLCD includes GPS lat/long and Google Plus Code widget, Home direction/distance widget, and average battery voltage widget. For B&W includes GPS Telemetry screen and Home distance telemetry screen.",
    "infourl": "https://github.com/kristjanbjarni/opentx-widgets",
    "images": [
      "ASSETS/gps-plus-code-home-arrow-and-avgbatt-widgets/screenshot-1.png",
      "ASSETS/gps-plus-code-home-arrow-and-avgbatt-widgets/screenshot-3.png",
      "ASSETS/gps-plus-code-home-arrow-and-avgbatt-widgets/screenshot-5.png"
    ],
    "tags": [
      "widget",
      "color",
      "black-and-white"
    ]
  },
  {
    "name": "GPS QR Code Generator",
    "category": "GPS & Mapping",
    "description": "Generates a QR code of last GPS coordinates received. For black-and-white screen radios only.",
    "infourl": "https://github.com/alufers/edgetx-gps-qrcode",
    "images": [
      "ASSETS/gps-qr-code-generator/screenshot-1.png",
      "ASSETS/gps-qr-code-generator/screenshot-3.png"
    ],
    "tags": [
      "script",
      "black-and-white",
      "gps"
    ]
  },
  {
    "name": "GPS Logger (BW only)",
    "category": "GPS & Mapping",
    "description": "Log each flight GPS coordinates to a separate GPX file. Telemetry script for radios with black-and-white displays only.",
    "infourl": "https://github.com/poweredjj/gpslog",
    "images": [
      "ASSETS/gps-logger-bw-only/screenshot-1.png"
    ],
    "tags": [
      "script",
      "black-and-white"
    ]
  },
  {
    "name": "GPS Logger (color only)",
    "category": "GPS & Mapping",
    "description": "Log each flight GPS coordinates to a separate GPX file. Widget for radios with color displays only.",
    "infourl": "https://github.com/poweredjj/gpslog_color",
    "images": [
      "ASSETS/gps-logger-color-only/screenshot-1.jpg"
    ],
    "tags": [
      "widget",
      "color"
    ]
  },
  {
    "name": "GPS Viewer",
    "category": "GPS & Mapping",
    "description": "Plot logged flight telemetry data on a map of your airfield.",
    "infourl": "https://github.com/ktaliaferro/gps-viewer",
    "images": [
      "ASSETS/gps-viewer/screenshot-1.png"
    ],
    "tags": [
      "script",
      "color"
    ]
  },
  {
    "name": "GPSQR",
    "category": "GPS & Mapping",
    "description": "Full-screen GPS and ELRS telemetry widget for color radios, with a scannable Google-Maps QR code of the model's last known position - point a phone at the radio to walk to a downed model. Shows distance to home, trip, height above take-off with MSL, speed, heading, satellites, flight time, mAh drawn and a full ELRS panel, and switches to a MAX debrief on landing. Betaflight and iNAV are detected automatically.",
    "infourl": "https://github.com/JoelFPV/GPSQR",
    "images": [
      "ASSETS/gpsqr/screenshot-1.png"
    ],
    "tags": [
      "widget",
      "color",
      "gps",
      "expresslrs",
      "crossfire",
      "betaflight",
      "inav",
      "quad",
      "fixed-wing"
    ]
  },
  {
    "name": "Recovery QR",
    "category": "GPS & Mapping",
    "description": "Color-screen widget that turns the model's latest valid GPS telemetry position into a native LVGL QR code for Google Maps. Saves the last known position per model so it survives telemetry loss and radio restarts, and shows it full-screen for quick recovery of a downed aircraft. Configurable telemetry source.",
    "infourl": "https://github.com/bultodepapas/edgetx-recovery-qr",
    "images": [
      "ASSETS/recovery-qr/screenshot-1.png",
      "ASSETS/recovery-qr/screenshot-2.png",
      "ASSETS/recovery-qr/screenshot-3.png",
      "ASSETS/recovery-qr/screenshot-4.png",
      "ASSETS/recovery-qr/screenshot-5.png"
    ],
    "tags": [
      "widget",
      "color",
      "gps"
    ]
  },
  {
    "name": "Rotorflight LUA Scripts",
    "category": "Flight Controller Config",
    "description": "LUA configurator for Rotorflight, a flight control software suite designed for single-rotor helicopters. Allows you to configure the flight controller directly from your transmitter. Also includes the RF Tool and RF Stats widgets (color radios, EdgeTX 2.11+) for displaying model name, a customizable sensor value, and flight statistics.",
    "infourl": "https://github.com/rotorflight/rotorflight-lua-scripts",
    "images": [],
    "tags": [
      "script",
      "widget",
      "color",
      "black-and-white",
      "heli",
      "rotorflight"
    ]
  },
  {
    "name": "Betaflight Setup",
    "category": "Flight Controller Config",
    "description": "The Betaflight LUA script allows you to change flight controller settings on your radio, such as PID, rates, VTX channels and power, and many more.",
    "infourl": "https://github.com/betaflight/betaflight-tx-lua-scripts",
    "images": [
      "ASSETS/betaflight-setup/screenshot-1.jpg"
    ],
    "tags": [
      "betaflight",
      "script",
      "color",
      "black-and-white",
      "quad"
    ]
  },
  {
    "name": "INAV Telemetry Flight Status",
    "category": "Telemetry & Widgets",
    "description": "Shows telemetry and flight status information. Supports radios with color and black and white screens.",
    "infourl": "https://github.com/iNavFlight/OpenTX-Telemetry-Widget",
    "images": [
      "ASSETS/inav-telemetry-flight-status/screenshot-1.png",
      "ASSETS/inav-telemetry-flight-status/screenshot-3.png"
    ],
    "tags": [
      "inav",
      "widget",
      "color",
      "black-and-white",
      "fixed-wing",
      "quad"
    ]
  },
  {